{
  "schemaVersion": "1.0.0",
  "asOf": "2026-09-04",
  "policyVersion": "raidbench-paid-answer-v2",
  "supportedCases": [
    {
      "caseId": "shadow_poe2_supported_002",
      "productId": "poe2-build-decision-review",
      "questionText": "My boss attempts fail after the first movement-heavy phase. Which observed build constraint should I test before replacing gear?",
      "inputs": {
        "currentPatch": "0.5.5 Forbidden Rites",
        "buildDescription": "Player-supplied skill, passive, item, defense, flask, and ten-attempt observation summary; no inspectable export or live-price evidence attached",
        "targetContent": "Player-named endgame boss encounter",
        "observedProblem": "Eight of ten attempts end during the same movement-heavy phase; damage uptime resumes slowly after repositioning",
        "budget": "50 Divine maximum; no current item price may be inferred"
      },
      "answerFocus": "Determine whether the supplied observations support a paid bottleneck diagnosis; refuse if the missing inspectable build or encounter evidence prevents prioritized repairs."
    },
    {
      "caseId": "shadow_palworld_supported_002",
      "productId": "palworld-base-progression-review",
      "questionText": "Produced ore accumulates at the work area while nearby storage stays unchanged. Which handoff should I test first?",
      "inputs": {
        "gameVersion": "1.0",
        "serverType": "Dedicated server with no production-changing mods reported",
        "currentGoal": "Move produced ore into storage during one twenty-minute controlled observation",
        "baseOrProgressionState": "Player records work-area ore rising from 40 to 120 while destination storage remains at 200; assignments and layout stay unchanged",
        "observedProblem": "Production increases but the recorded destination storage does not"
      },
      "answerFocus": "Identify the observed production-to-storage handoff as the first measured bottleneck, without claiming an unverified pathing or simulation mechanic."
    },
    {
      "caseId": "shadow_palworld_supported_003",
      "productId": "palworld-base-progression-review",
      "questionText": "My crafting queue remains at 100 units and the input stack does not change during a player-present test. What should I isolate next?",
      "inputs": {
        "gameVersion": "1.0",
        "serverType": "Single-player world with no work-speed mods reported",
        "currentGoal": "Start and measure one fixed crafting queue",
        "baseOrProgressionState": "Queue begins and ends at 100 units over fifteen minutes; input stack and output storage also remain unchanged; player keeps layout and assignments fixed",
        "observedProblem": "The recorded queue never begins consuming its supplied input"
      },
      "answerFocus": "Treat queue start as the observed bottleneck and propose one-variable assignment and station-state tests without inventing worker-suitability mechanics."
    },
    {
      "caseId": "shadow_palworld_supported_004",
      "productId": "palworld-base-progression-review",
      "questionText": "Crops increase during my test but the next processing input stays at zero. Where should I focus the next observation?",
      "inputs": {
        "gameVersion": "1.0",
        "serverType": "Private co-op host with no production-changing mods reported",
        "currentGoal": "Move one measured crop batch into the next processing step",
        "baseOrProgressionState": "Crop inventory rises by 80 during thirty minutes while the recorded downstream input remains zero; no layout or assignment change is made",
        "observedProblem": "The measured upstream output never appears in the next recorded input"
      },
      "answerFocus": "Diagnose only the observed inter-stage transfer gap and give a controlled handoff test; do not assert a specific game mechanic as the cause."
    },
    {
      "caseId": "shadow_palworld_supported_005",
      "productId": "palworld-base-progression-review",
      "questionText": "Items on the collection area rise while storage remains flat. How do I test whether collection is the first bottleneck?",
      "inputs": {
        "gameVersion": "1.0",
        "serverType": "Dedicated server with the same settings across both observations",
        "currentGoal": "Clear one measured collection batch into storage",
        "baseOrProgressionState": "Ground or collection-area count rises from 10 to 55 while destination storage stays at 300 during a twenty-minute player-present observation",
        "observedProblem": "Collected output accumulates before the recorded storage handoff"
      },
      "answerFocus": "Identify collection-to-storage as the first observed gap, then define a matched test that changes only the handoff assignment or route condition."
    },
    {
      "caseId": "shadow_palworld_supported_006",
      "productId": "palworld-base-progression-review",
      "questionText": "Two bases use the same observation window, but only Base A produces output. What is the safest comparison plan?",
      "inputs": {
        "gameVersion": "1.0",
        "serverType": "Dedicated server; both bases observed by the same player account",
        "currentGoal": "Explain the measured difference without changing multiple variables",
        "baseOrProgressionState": "Base A adds 60 units in thirty minutes; Base B adds zero; the player has not yet matched assignments, layout, storage, and travel conditions",
        "observedProblem": "The two bases produce different recorded deltas under an incompletely matched comparison"
      },
      "answerFocus": "Name the unmatched comparison as the current bottleneck and prioritize a one-variable matched test rather than inventing why Base B stops."
    },
    {
      "caseId": "shadow_palworld_supported_007",
      "productId": "palworld-base-progression-review",
      "questionText": "Output stops after storage reaches 95 of 100 recorded slots. How should I verify whether capacity is the first constraint?",
      "inputs": {
        "gameVersion": "1.0",
        "serverType": "Single-player world with unchanged settings",
        "currentGoal": "Maintain output through one additional controlled batch",
        "baseOrProgressionState": "Recorded output increases until destination storage reaches 95 of 100 tracked slots, then remains unchanged for the next ten minutes",
        "observedProblem": "The output stop correlates with the recorded destination nearing capacity"
      },
      "answerFocus": "Treat capacity only as a correlation, define a matched before-and-after storage-space test, and avoid asserting undocumented storage behavior."
    },
    {
      "caseId": "shadow_palworld_supported_008",
      "productId": "palworld-base-progression-review",
      "questionText": "Most of my upgrade session is spent traveling for one missing material. What should I change before farming more?",
      "inputs": {
        "gameVersion": "1.0",
        "serverType": "Single-player progression with no resource-rate mods reported",
        "currentGoal": "Complete the player-named upgrade with less repeated travel",
        "baseOrProgressionState": "Across three sixty-minute sessions, the player records 38, 41, and 43 minutes traveling for the same missing material while all other upgrade inputs are already staged",
        "observedProblem": "Travel for one player-identified material consumes most of each measured session"
      },
      "answerFocus": "Identify the measured travel share as the progression bottleneck, prioritize a route or staging experiment, and avoid claiming a best farming location."
    },
    {
      "caseId": "shadow_palworld_supported_009",
      "productId": "palworld-base-progression-review",
      "questionText": "Five boss attempts end during the same recovery window. What should I test before changing the whole team?",
      "inputs": {
        "gameVersion": "1.0",
        "serverType": "Single-player world with unchanged difficulty settings across attempts",
        "currentGoal": "Survive and measure the repeated recovery window",
        "baseOrProgressionState": "The player supplies timestamps for five attempts; each ends during the same recovery window, but no mechanic or damage-source claim is supplied",
        "observedProblem": "Failure repeats in one timestamped window while the rest of the attempt varies"
      },
      "answerFocus": "Identify the repeated recovery window as the observed progression bottleneck and propose one controlled preparation change without inventing boss mechanics."
    },
    {
      "caseId": "shadow_palworld_supported_010",
      "productId": "palworld-base-progression-review",
      "questionText": "My breeding queue has the same waiting gap in four observations. Which part should I measure before expanding the base?",
      "inputs": {
        "gameVersion": "1.0",
        "serverType": "Private co-op host with unchanged breeding settings",
        "currentGoal": "Reduce the repeated waiting gap without expanding multiple systems at once",
        "baseOrProgressionState": "Four timestamped cycles show the same idle interval between one completed player-recorded step and the next queue start; exact game cause is not supplied",
        "observedProblem": "A repeatable idle interval appears at the same recorded handoff"
      },
      "answerFocus": "Treat the repeated handoff interval as the measured bottleneck, propose one-variable timing observations, and avoid asserting breeding mechanics not in evidence."
    },
    {
      "caseId": "shadow_project_zomboid_supported_002",
      "productId": "project-zomboid-save-plan-review",
      "questionText": "A modded copy loads before a branch update but fails afterward. How should I isolate the compatibility break without touching the original save?",
      "inputs": {
        "currentBuild": "42.20.4 stable before the proposed branch comparison",